{
  "document": {
    "document_id": "doc_001",
    "source": "upload",
    "source_authority": "primary",
    "mime_type": "text/plain",
    "language": "und",
    "acl": {
      "users": [],
      "groups": ["compliance"]
    },
    "created_at": "2026-03-18T12:00:00Z"
  },
  "version": {
    "version_id": "v1",
    "document_id": "doc_001",
    "checksum": "sha256:example",
    "version_status": "active",
    "created_at": "2026-03-18T12:00:00Z"
  },
  "storage_uri": ".data/object_store/documents/doc_001/v1/example.txt",
  "artifact_uri": ".data/object_store/artifacts/doc_001/v1/blocks.json",
  "extraction_status": "extracted",
  "review_required": false,
  "review_reason": null,
  "blocks_count": 1,
  "text_length": 153,
  "document_class": "general_document",
  "document_family": "general",
  "chunking_strategy": "generic_structural",
  "classification_source": "deterministic",
  "classification_confidence": 0.91,
  "classification_reason_short": "Deterministic markers favored a general structured document."
}
